{
  "type": "commit",
  "hash": "a1b2c3d4e5f6a7b8c9d0e1f2a3b4c5d6e7f8a9b0",
  "date": "2026-04-15T09:45:00Z",
  "author": {
    "raw": "Jane Smith <jane.smith@example.com>",
    "user": {
      "type": "user",
      "display_name": "Jane Smith",
      "uuid": "{b2c3d4e5-f6a7-8901-bcde-f23456789012}"
    }
  },
  "message": "Add user authentication module with OAuth2 support",
  "parents": [
    {
      "hash": "9b8a7f6e5d4c3b2a1f0e9d8c7b6a5f4e3d2c1b0a"
    }
  ],
  "repository": {
    "type": "repository",
    "full_name": "acme-corp/web-application"
  }
}
